{
  "schema": "gis-ai-go.public-policy.v1",
  "policy_id": "gis-ai-go:public-policy:sha256:f39abe3f35f910dd27c9af9296bbccba33f76fec6d8d6acbba7c3b846d9a1e8f",
  "version": "1.0.0",
  "canonicalisation": "rfc8785-jcs",
  "compilation": {
    "kind": "compiled-json",
    "runtime": "gis-ai-go-gateway"
  },
  "default_effect": "deny",
  "applies_to": {
    "authority_profile": "anonymous-open",
    "access_tier": "open",
    "publication_classification": "public",
    "contains_personal_data": false,
    "contains_protected_data": false,
    "read_only": true
  },
  "rules": [
    {
      "rule_id": "public-catalogue-describe",
      "operation": "catalogue.describe",
      "effect": "allow-with-obligations",
      "obligations": [
        "inline-evidence-receipt",
        "not-attested",
        "not-persisted",
        "preserve-attribution",
        "preserve-described-resource-licence",
        "preserve-record-licence"
      ]
    },
    {
      "rule_id": "public-catalogue-search",
      "operation": "catalogue.search",
      "effect": "allow-with-obligations",
      "obligations": [
        "inline-evidence-receipt",
        "not-attested",
        "not-persisted",
        "preserve-attribution",
        "preserve-described-resource-licence",
        "preserve-record-licence"
      ]
    }
  ]
}
